{
  "version": 1,
  "repository": {
    "owner": "RealTimeLogic",
    "name": "LSP-Examples",
    "branch": "master"
  },
  "purpose": "AI-friendly index for selecting and copying BAS/Mako/Xedge examples.",
  "examples": [
    {
      "examplePath": "AJAX",
      "title": "AJAX",
      "summary": "Minimal LSP AJAX example where browser keypresses are posted to Lua and returned as JSON.",
      "tags": [
        "ajax",
        "browser-ui",
        "client-server",
        "json",
        "small"
      ],
      "goodFor": [
        "simple client/server request-response",
        "small browser UI examples",
        "submitting browser events or settings to Lua/LSP"
      ],
      "notFor": [
        "authentication",
        "large dashboards",
        "real-time pub/sub"
      ],
      "runtime": {
        "mako": "compatible",
        "xedge": "compatible",
        "notes": []
      },
      "appRoots": [
        {
          "appRootPath": "AJAX/www",
          "label": "AJAX demo",
          "run": "mako -l::www",
          "summary": "Runnable Mako app root for the AJAX request-response example.",
          "importantFiles": [
            "AJAX/www/index.lsp"
          ],
          "omitFromCompactContext": []
        }
      ],
      "readme": "AJAX/README.md",
      "rawReadmeUrl": "https://raw.githubusercontent.com/RealTimeLogic/LSP-Examples/refs/heads/master/AJAX/README.md"
    },
    {
      "examplePath": "AJAX-Over-WebSockets",
      "title": "REST / AJAX / RPC Over WebSockets",
      "summary": "Browser-to-Lua request/response calls over a persistent WebSocket transport.",
      "tags": [
        "ajax",
        "browser-ui",
        "client-server",
        "json",
        "rest",
        "websocket"
      ],
      "goodFor": [
        "browser RPC over WebSockets",
        "low-latency browser/server calls",
        "modern Promise based browser examples"
      ],
      "notFor": [
        "authentication",
        "file upload workflows",
        "SMQ pub/sub"
      ],
      "runtime": {
        "mako": "compatible",
        "xedge": "compatible",
        "notes": []
      },
      "appRoots": [
        {
          "appRootPath": "AJAX-Over-WebSockets/www",
          "label": "AJAX over WebSockets",
          "run": "mako -l::www",
          "summary": "WebSocket service and browser clients for asynchronous RPC-style calls.",
          "importantFiles": [
            "AJAX-Over-WebSockets/www/.preload",
            "AJAX-Over-WebSockets/www/index.html",
            "AJAX-Over-WebSockets/www/promise.html",
            "AJAX-Over-WebSockets/www/service.lsp"
          ],
          "omitFromCompactContext": []
        }
      ],
      "readme": "AJAX-Over-WebSockets/README.md",
      "rawReadmeUrl": "https://raw.githubusercontent.com/RealTimeLogic/LSP-Examples/refs/heads/master/AJAX-Over-WebSockets/README.md"
    },
    {
      "examplePath": "authentication",
      "title": "Lua Authentication Examples",
      "summary": "Three BAS authentication patterns for protecting an app root, a subdirectory, or individual pages.",
      "tags": [
        "authentication",
        "browser-ui",
        "security"
      ],
      "goodFor": [
        "basic BAS authentication examples",
        "protecting entire applications",
        "protecting subdirectories or individual pages"
      ],
      "notFor": [
        "production password storage design",
        "single sign-on",
        "WebAuthn"
      ],
      "runtime": {
        "mako": "compatible",
        "xedge": "compatible",
        "notes": [
          "Digest/basic credentials may be cached by browsers while testing."
        ]
      },
      "appRoots": [
        {
          "appRootPath": "authentication/root",
          "label": "Root-protected auth",
          "run": "mako -l::root",
          "summary": "Authenticator applied to the full application root.",
          "importantFiles": [
            "authentication/root/.preload",
            "authentication/root/index.lsp"
          ],
          "omitFromCompactContext": [
            "authentication/root/public/style.css"
          ]
        },
        {
          "appRootPath": "authentication/semiautomatic",
          "label": "Semiautomatic page auth",
          "run": "mako -l::semiautomatic",
          "summary": "Pages that call authentication manually through shared page logic.",
          "importantFiles": [
            "authentication/semiautomatic/.preload",
            "authentication/semiautomatic/index.lsp",
            "authentication/semiautomatic/page1.lsp",
            "authentication/semiautomatic/page2.lsp",
            "authentication/semiautomatic/page3.lsp"
          ],
          "omitFromCompactContext": [
            "authentication/semiautomatic/style.css"
          ]
        },
        {
          "appRootPath": "authentication/subdir",
          "label": "Subdirectory auth",
          "run": "mako -l::subdir",
          "summary": "Authenticator applied to only the protected subdirectory branch.",
          "importantFiles": [
            "authentication/subdir/.preload",
            "authentication/subdir/index.lsp",
            "authentication/subdir/my-protected/index.lsp"
          ],
          "omitFromCompactContext": [
            "authentication/subdir/style.css"
          ]
        }
      ],
      "readme": "authentication/README.md",
      "rawReadmeUrl": "https://raw.githubusercontent.com/RealTimeLogic/LSP-Examples/refs/heads/master/authentication/README.md"
    },
    {
      "examplePath": "AWS-MQTT",
      "title": "AWS IoT Core MQTT",
      "summary": "MQTT client example for connecting to AWS IoT Core with ALPN and mutual TLS.",
      "tags": [
        "iot",
        "mqtt",
        "security",
        "xedge32"
      ],
      "goodFor": [
        "AWS IoT Core MQTT connection examples",
        "mutual TLS MQTT setup",
        "publishing JSON data to cloud topics"
      ],
      "notFor": [
        "browser UI examples",
        "local MQTT broker implementation",
        "offline-only examples"
      ],
      "runtime": {
        "mako": "compatible",
        "xedge": "compatible",
        "notes": [
          "Requires AWS endpoint, CA certificate, device certificate, and private key before it will connect."
        ]
      },
      "appRoots": [
        {
          "appRootPath": "AWS-MQTT/www",
          "label": "AWS MQTT client",
          "run": "mako -l::www",
          "summary": "Startup-only MQTT client application for AWS IoT Core.",
          "importantFiles": [
            "AWS-MQTT/www/.preload"
          ],
          "omitFromCompactContext": []
        }
      ],
      "readme": "AWS-MQTT/README.md",
      "rawReadmeUrl": "https://raw.githubusercontent.com/RealTimeLogic/LSP-Examples/refs/heads/master/AWS-MQTT/README.md"
    },
    {
      "examplePath": "CGI",
      "title": "CGI Plugin and Examples",
      "summary": "Lua CGI compatibility layer using forkpty to run external CGI scripts.",
      "tags": [
        "cgi",
        "http-api",
        "lua",
        "mako"
      ],
      "goodFor": [
        "CGI compatibility experiments",
        "external process integration",
        "porting CGI scripts to BAS"
      ],
      "notFor": [
        "embedded RTOS deployments",
        "small browser UI examples",
        "Windows-only targets"
      ],
      "runtime": {
        "mako": "partial",
        "xedge": "partial",
        "notes": [
          "Depends on the forkpty plugin and is intended for Linux, macOS, and QNX."
        ]
      },
      "appRoots": [
        {
          "appRootPath": "CGI/www",
          "label": "CGI bridge",
          "run": "mako -l::www",
          "summary": "App root that mounts a CGI directory into the BAS virtual file system.",
          "importantFiles": [
            "CGI/www/.lua/cgi.lua",
            "CGI/www/.preload",
            "CGI/www/index.lsp"
          ],
          "omitFromCompactContext": []
        }
      ],
      "readme": "CGI/README.md",
      "rawReadmeUrl": "https://raw.githubusercontent.com/RealTimeLogic/LSP-Examples/refs/heads/master/CGI/README.md"
    },
    {
      "examplePath": "command-env",
      "title": "Command Environment",
      "summary": "Examples showing request/response environment behavior with includes and forwards.",
      "tags": [
        "lua",
        "small"
      ],
      "goodFor": [
        "LSP include examples",
        "LSP request forwarding examples",
        "understanding ephemeral request/response environment"
      ],
      "notFor": [
        "browser UI applications",
        "device-control UI",
        "security examples"
      ],
      "runtime": {
        "mako": "compatible",
        "xedge": "compatible",
        "notes": []
      },
      "appRoots": [
        {
          "appRootPath": "command-env/forward",
          "label": "Forward command environment",
          "run": "mako -l::forward",
          "summary": "LSP forward-chain example.",
          "importantFiles": [
            "command-env/forward/.second.lsp",
            "command-env/forward/.third.lsp",
            "command-env/forward/first.lsp",
            "command-env/forward/index.lsp"
          ],
          "omitFromCompactContext": []
        },
        {
          "appRootPath": "command-env/include",
          "label": "Include command environment",
          "run": "mako -l::include",
          "summary": "LSP include example with shared header and footer pages.",
          "importantFiles": [
            "command-env/include/.footer.lsp",
            "command-env/include/.header.lsp",
            "command-env/include/index.lsp",
            "command-env/include/page1.lsp",
            "command-env/include/page2.lsp"
          ],
          "omitFromCompactContext": []
        }
      ],
      "readme": "command-env/README.md",
      "rawReadmeUrl": "https://raw.githubusercontent.com/RealTimeLogic/LSP-Examples/refs/heads/master/command-env/README.md"